{
    "$schema": "https://json-schema.org/draft/2020-12/schema",
    "$id": "asset.schema.json",
    "title": "Archive assets",
    "type": "array",
    "items": {
        "type": "object",
        "required": ["id", "type", "role", "caption"],
        "properties": {
            "id": {
                "$ref": "shared.schema.json#/$defs/archiveId"
            },
            "type": {
                "type": "string"
            },
            "path": {
                "type": "string",
                "minLength": 1
            },
            "role": {
                "type": "string",
                "minLength": 1
            },
            "caption": {
                "$ref": "shared.schema.json#/$defs/localizedText"
            },
            "subcaption": {
                "$ref": "shared.schema.json#/$defs/optionalLocalizedText"
            },
            "language": {
                "type": "string",
                "minLength": 2
            },
            "deliveryUrl": {
                "type": "string",
                "format": "uri"
            },
            "storage": {
                "type": "object",
                "properties": {
                    "profileId": {
                        "$ref": "shared.schema.json#/$defs/archiveId"
                    },
                    "profile": {
                        "$ref": "shared.schema.json#/$defs/archiveId"
                    },
                    "objectName": {
                        "type": "string",
                        "minLength": 1
                    },
                    "provider": {
                        "type": "string",
                        "minLength": 1
                    },
                    "objectKey": {
                        "type": "string",
                        "minLength": 1
                    },
                    "sourcePath": {
                        "type": "string",
                        "minLength": 1
                    },
                    "contentType": {
                        "type": "string",
                        "pattern": "^audio/"
                    },
                    "cacheControl": {
                        "type": "string",
                        "minLength": 1
                    },
                    "publicUrl": {
                        "type": "string",
                        "format": "uri"
                    }
                },
                "additionalProperties": false
            },
            "figureIds": {
                "type": "array",
                "items": {
                    "$ref": "shared.schema.json#/$defs/archiveId"
                },
                "uniqueItems": true
            },
            "sourceId": {
                "$ref": "shared.schema.json#/$defs/archiveId"
            },
            "sourceIds": {
                "$ref": "shared.schema.json#/$defs/sourceIdList"
            },
            "rights": {
                "type": "object",
                "properties": {
                    "status": {
                        "type": "string"
                    },
                    "license": {
                        "$ref": "shared.schema.json#/$defs/optionalLocalizedText"
                    },
                    "usage": {
                        "$ref": "shared.schema.json#/$defs/optionalLocalizedText"
                    }
                },
                "additionalProperties": true
            },
            "usage": {
                "type": "array",
                "items": {
                    "type": "string"
                },
                "uniqueItems": true
            },
            "editable": {
                "type": "boolean"
            },
            "review": {
                "$ref": "shared.schema.json#/$defs/reviewState"
            }
        },
        "anyOf": [
            {
                "required": ["sourceId"]
            },
            {
                "required": ["sourceIds"]
            }
        ],
        "additionalProperties": true,
        "allOf": [
            {
                "if": {
                    "properties": {
                        "type": {
                            "const": "audio"
                        }
                    },
                    "required": ["type"]
                },
                "then": {
                    "required": ["language", "storage"]
                },
                "else": {
                    "required": ["path"]
                }
            }
        ]
    }
}
