[
  {
    "id": "asset-2024-ai-scientist-architecture-01",
    "type": "image",
    "path": "resources/images/2024-ai-scientist/architecture/2024-ai-scientist_architecture_01.png",
    "role": "architecture-explainer",
    "caption": {
      "zh": "AI科学家与自主实验室结构图 1",
      "en": "AI Scientists and Autonomous Laboratories structure diagram 1"
    },
    "subcaption": {
      "zh": "展示AI科学家与自主实验室的关键组件、连接或信息流。",
      "en": "Shows the key components, connections, or information flow of AI Scientists and Autonomous Laboratories."
    },
    "sourceId": "source-legacy-event-record",
    "rights": {
      "status": "local-redraw",
      "license": {
        "zh": "Migrated from legacy media metadata; verify rights before publication.",
        "en": "Migrated from legacy media metadata; verify rights before publication."
      }
    },
    "usage": [
      "variant:deep-learning"
    ],
    "editable": true
  },
  {
    "id": "asset-2024-ai-scientist-architecture-02",
    "type": "image",
    "path": "resources/images/2024-ai-scientist/architecture/2024-ai-scientist_architecture_02.png",
    "role": "architecture-explainer",
    "caption": {
      "zh": "AI科学家与自主实验室结构图 2",
      "en": "AI Scientists and Autonomous Laboratories structure diagram 2"
    },
    "subcaption": {
      "zh": "展示AI科学家与自主实验室的关键组件、连接或信息流。",
      "en": "Shows the key components, connections, or information flow of AI Scientists and Autonomous Laboratories."
    },
    "sourceId": "source-legacy-event-record",
    "rights": {
      "status": "local-redraw",
      "license": {
        "zh": "Migrated from legacy media metadata; verify rights before publication.",
        "en": "Migrated from legacy media metadata; verify rights before publication."
      }
    },
    "usage": [
      "variant:deep-learning"
    ],
    "editable": true
  },
  {
    "id": "asset-2024-ai-scientist-papers-01",
    "type": "image",
    "path": "resources/images/2024-ai-scientist/papers/2024-ai-scientist_papers_01.png",
    "role": "paper-page",
    "caption": {
      "zh": "《AI 科学家》（第 1 页资料）",
      "en": "The AI Scientist — page reference 1"
    },
    "subcaption": {
      "zh": "原论文页面或相关页面的图像资料。",
      "en": "Image reference from the original paper or a related paper page."
    },
    "sourceId": "source-legacy-event-record",
    "rights": {
      "status": "external-reference",
      "license": {
        "zh": "Migrated from legacy media metadata; verify rights before publication.",
        "en": "Migrated from legacy media metadata; verify rights before publication."
      }
    },
    "usage": [
      "variant:deep-learning"
    ],
    "editable": true
  },
  {
    "id": "asset-2024-ai-scientist-people-01",
    "type": "image",
    "path": "resources/images/2024-ai-scientist/people/2024-ai-scientist_people_01.png",
    "role": "team-photo",
    "caption": {
      "zh": "伯克利 A-Lab 研究团队",
      "en": "Berkeley A-Lab research team"
    },
    "subcaption": {
      "zh": "自动化实验室研究人员在材料实验环境中工作。",
      "en": "Automated-laboratory researchers working in a materials lab."
    },
    "sourceId": "source-legacy-event-record",
    "rights": {
      "status": "external-reference",
      "license": {
        "zh": "Migrated from legacy media metadata; verify rights before publication.",
        "en": "Migrated from legacy media metadata; verify rights before publication."
      }
    },
    "usage": [
      "variant:deep-learning"
    ],
    "editable": true,
    "figureIds": [
      "berkeley-team"
    ]
  },
  {
    "id": "asset-2024-ai-scientist-people-02",
    "type": "image",
    "path": "resources/images/2024-ai-scientist/people/2024-ai-scientist_people_02.png",
    "role": "team-photo",
    "caption": {
      "zh": "Sakana AI 团队",
      "en": "Sakana AI team"
    },
    "subcaption": {
      "zh": "AI Scientist 项目的开发团队资料照。",
      "en": "Reference photo of the team developing the AI Scientist project."
    },
    "sourceId": "source-legacy-event-record",
    "rights": {
      "status": "external-reference",
      "license": {
        "zh": "Migrated from legacy media metadata; verify rights before publication.",
        "en": "Migrated from legacy media metadata; verify rights before publication."
      }
    },
    "usage": [
      "variant:deep-learning"
    ],
    "editable": true,
    "figureIds": [
      "sakana-ai-team"
    ]
  },
  {
    "id": "asset-2024-ai-scientist-audio-zh-original-v1",
    "type": "audio",
    "path": "https://media.sciencearena.cn/audio/ai-history/releases/2024-ai-scientist-zh-original-v1.mp3",
    "role": "audio-narration",
    "caption": {
      "zh": "2024-ai-scientist 中文原版科普音频",
      "en": "2024-ai-scientist original Chinese audio narration"
    },
    "subcaption": {
      "zh": "中文原版科普讲述，供中文页面播放。",
      "en": "Original Chinese science narration used on the Chinese page."
    },
    "sourceId": "source-ai-scientist-paper",
    "rights": {
      "status": "project-produced",
      "license": {
        "zh": "本项目使用已授权语音合成服务制作。",
        "en": "Produced by this project with an authorized text-to-speech service."
      },
      "usage": {
        "zh": "用于本展览的事件科普音频播放。",
        "en": "Used for event narration in this exhibition."
      }
    },
    "language": "zh",
    "deliveryUrl": "https://media.sciencearena.cn/audio/ai-history/releases/2024-ai-scientist-zh-original-v1.mp3",
    "storage": {
      "provider": "aliyun-oss",
      "bucket": "[REDACTED_OSS_BUCKET]",
      "objectKey": "audio/ai-history/releases/2024-ai-scientist-zh-original-v1.mp3",
      "sourcePath": "resources/audio/generated/remaining-storylines-original-v1/deep-learning-remaining-storyline-zh-original-v1-2026-08-09/audio/deep-learning/storyline/zh/29-2024-ai-scientist.mp3",
      "contentType": "audio/mpeg",
      "cacheControl": "public, max-age=31536000, immutable"
    },
    "usage": [
      "variant:deep-learning"
    ],
    "editable": true
  },
  {
    "id": "asset-2024-ai-scientist-audio-en-v1",
    "type": "audio",
    "path": "https://media.sciencearena.cn/audio/ai-history/releases/2024-ai-scientist-en-v1.mp3",
    "role": "audio-narration",
    "caption": {
      "zh": "2024-ai-scientist 英文科普音频",
      "en": "2024-ai-scientist English audio narration"
    },
    "subcaption": {
      "zh": "英文原版科普讲述，供英文页面播放。",
      "en": "Original English science narration used on the English page."
    },
    "sourceId": "source-ai-scientist-paper",
    "rights": {
      "status": "project-produced",
      "license": {
        "zh": "本项目使用已授权语音合成服务制作。",
        "en": "Produced by this project with an authorized text-to-speech service."
      },
      "usage": {
        "zh": "用于本展览的事件科普音频播放。",
        "en": "Used for event narration in this exhibition."
      }
    },
    "language": "en",
    "deliveryUrl": "https://media.sciencearena.cn/audio/ai-history/releases/2024-ai-scientist-en-v1.mp3",
    "storage": {
      "provider": "aliyun-oss",
      "bucket": "[REDACTED_OSS_BUCKET]",
      "objectKey": "audio/ai-history/releases/2024-ai-scientist-en-v1.mp3",
      "sourcePath": "resources/audio/generated/remaining-storylines-original-v1/deep-learning-remaining-storyline-en-original-v1-2026-08-09/audio/deep-learning/storyline/en/29-2024-ai-scientist.mp3",
      "contentType": "audio/mpeg",
      "cacheControl": "public, max-age=31536000, immutable"
    },
    "usage": [
      "variant:deep-learning"
    ],
    "editable": true
  }
]
